Airport code,City,State,Airport name ,data source id,ranking,,,,,Airport used 
PUB,Pueblo, CO, Pueblo Memorial (PUB),#REF!,,FALSE,FALSE,'PUB',0,FALSE
PGD,Punta Gorda, FL, Punta Gorda Airport (PGD),#REF!,,FALSE,FALSE,'PGD',0,FALSE
UIN,Quincy, IL, Quincy Regional-Baldwin Field (UIN),#REF!,,FALSE,FALSE,'UIN',0,FALSE
PBI,West Palm Beach/Palm Beach, FL, Palm Beach International (PBI),#REF!,2,FALSE,#REF!,'PBI',1,PBI
RCA,Rapid City, SD, Ellsworth AFB (RCA),#REF!,,FALSE,FALSE,'RCA',0,FALSE
RAP,Rapid City, SD, Rapid City Regional (RAP),#REF!,,FALSE,FALSE,'RAP',0,FALSE
RDR,Red River, ND, Grand Forks AFB (RDR),#REF!,,FALSE,FALSE,'RDR',0,FALSE
RDD,Redding, CA, Redding Municipal (RDD),#REF!,,FALSE,FALSE,'RDD',0,FALSE
PDX,Portland, OR, Portland International (PDX),#REF!,1,#REF!,FALSE,'PDX',1,PDX
RHI,Rhinelander, WI, Rhinelander/Oneida County (RHI),#REF!,,FALSE,FALSE,'RHI',0,FALSE
PHL,Philadelphia, PA, Philadelphia International (PHL),#REF!,1,#REF!,FALSE,'PHL',1,PHL
RIW,Riverton/Lander, WY, Riverton Regional (RIW),#REF!,,FALSE,FALSE,'RIW',0,FALSE
ROA,Roanoke, VA, Roanoke Blacksburg Regional Woodrum Field (ROA),#REF!,,FALSE,FALSE,'ROA',0,FALSE
PHX,Phoenix, AZ, Phoenix Sky Harbor International (PHX),#REF!,1,#REF!,FALSE,'PHX',1,PHX
PIT,Pittsburgh, PA, Pittsburgh International (PIT),#REF!,2,FALSE,#REF!,'PIT',1,PIT
RKS,Rock Springs, WY, Southwest Wyoming Regional (RKS),#REF!,,FALSE,FALSE,'RKS',0,FALSE
RFD,Rockford, IL, Chicago/Rockford International (RFD),#REF!,,FALSE,FALSE,'RFD',0,FALSE
ROW,Roswell, NM, Roswell International Air Center (ROW),#REF!,,FALSE,FALSE,'ROW',0,FALSE
ROP,Rota, TT, Benjamin Taisacan Manglona International (ROP),#REF!,,FALSE,FALSE,'ROP',0,FALSE
PSC,Pasco/Kennewick/Richland, WA, Tri Cities (PSC),#REF!,2,FALSE,#REF!,'PSC',1,PSC
MBS,Saginaw/Bay City/Midland, MI, MBS International (MBS),#REF!,,FALSE,FALSE,'MBS',0,FALSE
SPN,Saipan, TT, Francisco C. Ada Saipan International (SPN),#REF!,,FALSE,FALSE,'SPN',0,FALSE
SLE,Salem, OR, McNary Field (SLE),#REF!,,FALSE,FALSE,'SLE',0,FALSE
SLN,Salina, KS, Salina Regional (SLN),#REF!,,FALSE,FALSE,'SLN',0,FALSE
PSP,Palm Springs, CA, Palm Springs International (PSP),#REF!,2,FALSE,#REF!,'PSP',1,PSP
SJT,San Angelo, TX, San Angelo Regional/Mathis Field (SJT),#REF!,,FALSE,FALSE,'SJT',0,FALSE
RDU,Raleigh/Durham, NC, Raleigh-Durham International (RDU),#REF!,1,#REF!,FALSE,'RDU',1,RDU
RIC,Richmond, VA, Richmond International (RIC),#REF!,2,FALSE,#REF!,'RIC',1,RIC
RNO,Reno, NV, Reno/Tahoe International (RNO),#REF!,2,FALSE,#REF!,'RNO',1,RNO
ROC,Rochester, NY, Greater Rochester International (ROC),#REF!,2,FALSE,#REF!,'ROC',1,ROC
RST,Rochester, MN, Rochester International (RST),#REF!,2,FALSE,#REF!,'RST',1,RST
SBP,San Luis Obispo, CA, San Luis County Regional (SBP),#REF!,,FALSE,FALSE,'SBP',0,FALSE
SFB,Sanford, FL, Orlando Sanford International (SFB),#REF!,,FALSE,FALSE,'SFB',0,FALSE
SNA,Santa Ana, CA, John Wayne Airport-Orange County (SNA),#REF!,,FALSE,FALSE,'SNA',0,FALSE
SBA,Santa Barbara, CA, Santa Barbara Municipal (SBA),#REF!,,FALSE,FALSE,'SBA',0,FALSE
SAF,Santa Fe, NM, Santa Fe Municipal (SAF),#REF!,,FALSE,FALSE,'SAF',0,FALSE
SMX,Santa Maria, CA, Santa Maria Public/Capt. G. Allan Hancock Field (SMX),#REF!,,FALSE,FALSE,'SMX',0,FALSE
STS,Santa Rosa, CA, Charles M. Schulz - Sonoma County (STS),#REF!,,FALSE,FALSE,'STS',0,FALSE
SRQ,Sarasota/Bradenton, FL, Sarasota/Bradenton International (SRQ),#REF!,,FALSE,FALSE,'SRQ',0,FALSE
CIU,Sault Ste. Marie, MI, Chippewa County International (CIU),#REF!,,FALSE,FALSE,'CIU',0,FALSE
RSW,Fort Myers, FL, Southwest Florida International (RSW),#REF!,2,FALSE,#REF!,'RSW',1,RSW
BFF,Scottsbluff, NE, Western Neb. Regional/William B. Heilig Field (BFF),#REF!,,FALSE,FALSE,'BFF',0,FALSE
AVP,Scranton/Wilkes-Barre, PA, Wilkes Barre Scranton International (AVP),#REF!,,FALSE,FALSE,'AVP',0,FALSE
SAN,San Diego, CA, San Diego International (SAN),#REF!,1,#REF!,FALSE,'SAN',1,SAN
SAT,San Antonio, TX, San Antonio International (SAT),#REF!,2,FALSE,#REF!,'SAT',1,SAT
SHR,Sheridan, WY, Sheridan County (SHR),#REF!,,FALSE,FALSE,'SHR',0,FALSE
SAV,Savannah, GA, Savannah/Hilton Head International (SAV),#REF!,2,FALSE,#REF!,'SAV',1,SAV
SUX,Sioux City, IA, Sioux Gateway Brig Gen Bud Day Field (SUX),#REF!,,FALSE,FALSE,'SUX',0,FALSE
FSD,Sioux Falls, SD, Joe Foss Field (FSD),#REF!,,FALSE,FALSE,'FSD',0,FALSE
SIT,Sitka, AK, Sitka Rocky Gutierrez (SIT),#REF!,,FALSE,FALSE,'SIT',0,FALSE
SBN,South Bend, IN, South Bend International (SBN),#REF!,,FALSE,FALSE,'SBN',0,FALSE
SCK,Stockton, CA, Stockton Metropolitan (SCK),#REF!,2,FALSE,#REF!,'SCK',1,SCK
SEA,Seattle, WA, Seattle/Tacoma International (SEA),#REF!,1,#REF!,FALSE,'SEA',1,SEA
SPI,Springfield, IL, Abraham Lincoln Capital (SPI),#REF!,,FALSE,FALSE,'SPI',0,FALSE
SGF,Springfield, MO, Springfield-Branson National (SGF),#REF!,,FALSE,FALSE,'SGF',0,FALSE
UST,St. Augustine, FL, Northeast Florida Regional (UST),#REF!,,FALSE,FALSE,'UST',0,FALSE
STC,St. Cloud, MN, St. Cloud Regional (STC),#REF!,,FALSE,FALSE,'STC',0,FALSE
SGU,St. George, UT, St George Regional (SGU),#REF!,,FALSE,FALSE,'SGU',0,FALSE
SFO,San Francisco, CA, San Francisco International (SFO),#REF!,1,#REF!,FALSE,'SFO',1,SFO
KSM,St. Mary&#39;s, AK, St. Mary&#39;s Airport (KSM),#REF!,,FALSE,FALSE,'KSM',0,FALSE
PIE,St. Petersburg, FL, St Pete Clearwater International (PIE),#REF!,,FALSE,FALSE,'PIE',0,FALSE
SCE,State College, PA, University Park (SCE),#REF!,,FALSE,FALSE,'SCE',0,FALSE
SHD,Staunton, VA, Shenandoah Valley Regional (SHD),#REF!,,FALSE,FALSE,'SHD',0,FALSE
SWO,Stillwater, OK, Stillwater Regional (SWO),#REF!,,FALSE,FALSE,'SWO',0,FALSE
SHV,Shreveport, LA, Shreveport Regional (SHV),#REF!,2,FALSE,#REF!,'SHV',1,SHV
SUN,Sun Valley/Hailey/Ketchum, ID, Friedman Memorial (SUN),#REF!,,FALSE,FALSE,'SUN',0,FALSE
SJC,San Jose, CA, Norman Y. Mineta San Jose International (SJC),#REF!,2,FALSE,#REF!,'SJC',1,SJC
SJU,San Juan, PR, Luis Munoz Marin International (SJU),#REF!,2,FALSE,#REF!,'SJU',1,SJU
SKA,Spokane, WA, Fairchild AFB (SKA),#REF!,2,FALSE,#REF!,'SKA',1,SKA
TEX,Telluride, CO, Telluride Regional (TEX),#REF!,,FALSE,FALSE,'TEX',0,FALSE
TXK,Texarkana, AR, Texarkana Regional-Webb Field (TXK),#REF!,,FALSE,FALSE,'TXK',0,FALSE
TKI,Tokeen, AK, Tokeen Airport (TKI),#REF!,,FALSE,FALSE,'TKI',0,FALSE
SLC,Salt Lake City, UT, Salt Lake City International (SLC),#REF!,1,#REF!,FALSE,'SLC',1,SLC
FOE,Topeka, KS, Topeka Regional (FOE),#REF!,,FALSE,FALSE,'FOE',0,FALSE
TVC,Traverse City, MI, Cherry Capital (TVC),#REF!,,FALSE,FALSE,'TVC',0,FALSE
SMF,Sacramento, CA, Sacramento International (SMF),#REF!,2,FALSE,#REF!,'SMF',1,SMF
TUS,Tucson, AZ, Tucson International (TUS),#REF!,,FALSE,FALSE,'TUS',0,FALSE
TUL,Tulsa, OK, Tulsa International (TUL),#REF!,,FALSE,FALSE,'TUL',0,FALSE
UTM,Tunica, MS, Tunica Municipal (UTM),#REF!,,FALSE,FALSE,'UTM',0,FALSE
TUP,Tupelo, MS, Tupelo Regional (TUP),#REF!,,FALSE,FALSE,'TUP',0,FALSE
TWF,Twin Falls, ID, Joslin Field - Magic Valley Regional (TWF),#REF!,,FALSE,FALSE,'TWF',0,FALSE
TYR,Tyler, TX, Tyler Pounds Regional (TYR),#REF!,,FALSE,FALSE,'TYR',0,FALSE
DUT,Unalaska, AK, Unalaska Airport (DUT),#REF!,,FALSE,FALSE,'DUT',0,FALSE
UCA,Utica/Rome, NY, Oneida County (UCA),#REF!,,FALSE,FALSE,'UCA',0,FALSE
VLD,Valdosta, GA, Valdosta Regional (VLD),#REF!,,FALSE,FALSE,'VLD',0,FALSE
VPS,Valparaiso, FL, Eglin AFB Destin Fort Walton Beach (VPS),#REF!,,FALSE,FALSE,'VPS',0,FALSE
VEL,Vernal, UT, Vernal Regional (VEL),#REF!,,FALSE,FALSE,'VEL',0,FALSE
VCT,Victoria, TX, Victoria Regional (VCT),#REF!,,FALSE,FALSE,'VCT',0,FALSE
VIS,Visalia, CA, Visalia Municipal (VIS),#REF!,,FALSE,FALSE,'VIS',0,FALSE
ACT,Waco, TX, Waco Regional (ACT),#REF!,,FALSE,FALSE,'ACT',0,FALSE
STL,St. Louis, MO, St Louis Lambert International (STL),#REF!,2,FALSE,#REF!,'STL',1,STL
SYR,Syracuse, NY, Syracuse Hancock International (SYR),#REF!,2,FALSE,#REF!,'SYR',1,SYR
ALO,Waterloo, IA, Waterloo Regional (ALO),#REF!,,FALSE,FALSE,'ALO',0,FALSE
ART,Watertown, NY, Watertown International (ART),#REF!,,FALSE,FALSE,'ART',0,FALSE
ATY,Watertown, SD, Watertown Regional (ATY),#REF!,,FALSE,FALSE,'ATY',0,FALSE
ENV,Wendover, UT, Wendover Airport (ENV),#REF!,,FALSE,FALSE,'ENV',0,FALSE
TLH,Tallahassee, FL, Tallahassee International (TLH),#REF!,2,FALSE,#REF!,'TLH',1,TLH
WYS,West Yellowstone, MT, Yellowstone (WYS),#REF!,,FALSE,FALSE,'WYS',0,FALSE
HPN,White Plains, NY, Westchester County (HPN),#REF!,,FALSE,FALSE,'HPN',0,FALSE
SPS,Wichita Falls, TX, Sheppard AFB/Wichita Falls Municipal (SPS),#REF!,,FALSE,FALSE,'SPS',0,FALSE
TOL,Toledo, OH, Toledo Express (TOL),#REF!,2,FALSE,#REF!,'TOL',1,TOL
IPT,Williamsport, PA, Williamsport Regional (IPT),#REF!,,FALSE,FALSE,'IPT',0,FALSE
ISN,Williston, ND, Sloulin Field International (ISN),#REF!,,FALSE,FALSE,'ISN',0,FALSE
XWA,Williston, ND, Williston Basin International (XWA),#REF!,,FALSE,FALSE,'XWA',0,FALSE
TPA,Tampa, FL, Tampa International (TPA),#REF!,1,#REF!,FALSE,'TPA',1,TPA
ILM,Wilmington, NC, Wilmington International (ILM),#REF!,,FALSE,FALSE,'ILM',0,FALSE
TTN,Trenton, NJ, Trenton Mercer (TTN),#REF!,2,FALSE,#REF!,'TTN',1,TTN
WRG,Wrangell, AK, Wrangell Airport (WRG),#REF!,,FALSE,FALSE,'WRG',0,FALSE
YKM,Yakima, WA, Yakima Air Terminal/McAllister Field (YKM),#REF!,,FALSE,FALSE,'YKM',0,FALSE
YAK,Yakutat, AK, Yakutat Airport (YAK),#REF!,,FALSE,FALSE,'YAK',0,FALSE
YAP,Yap, Federated States of Micronesia, Yap International (YAP),#REF!,,FALSE,FALSE,'YAP',0,FALSE
YNG,Youngstown/Warren, OH, Youngstown-Warren Regional (YNG),#REF!,,FALSE,FALSE,'YNG',0,FALSE
YUM,Yuma, AZ, Yuma MCAS/Yuma International (YUM),#REF!,,FALSE,FALSE,'YUM',0,FALSE
